{
  "bank_slug": "askari-bank",
  "bank_name": "Askari Bank Limited",
  "retrieved_note": "Pilot agent extraction from official public pages and SOC PDF. Normalize before shipping to UI.",
  "cards": [
    {
      "card_name": "Askari Mastercard Classic Credit Card",
      "card_type": "credit",
      "tier": "classic",
      "requirements": {
        "minimum_monthly_salary_pkr": 35000,
        "minimum_relationship_balance_pkr": 150000,
        "annual_fee_pkr": 5000,
        "annual_fee_waiver_rule": "70% waiver on 50% utilization of total limit within 3 months of issuance or renewal.",
        "minimum_age_years": 21,
        "maximum_age_years": 70
      },
      "sources": [
        "https://askaribank.com/personal/cards/mastercard-credit-cards",
        "https://askaribank.com/gallery/SOC%2001-01-2026%20Final-1212025.pdf"
      ],
      "confidence": "high",
      "notes": [
        "Shared public eligibility grid across Classic, Gold, and Platinum.",
        "The lowest published salaried threshold on the official page is PKR 35,000 for GOP/Semi-Govt./Autonomous permanent employees; approved-company and non-approved-company applicants are shown at higher salary bands.",
        "SEB/SEP applicants are shown separately on the official page with PKR 150,000 average-balance criterion.",
        "The FAQ on the same page splits maximum age as 60 for permanent salaried, 65 for contractual salaried/pensioners, and 70 for SEB/SEP."
      ]
    },
    {
      "card_name": "Askari Mastercard Gold Credit Card",
      "card_type": "credit",
      "tier": "gold",
      "requirements": {
        "minimum_monthly_salary_pkr": 35000,
        "minimum_relationship_balance_pkr": 150000,
        "annual_fee_pkr": 11000,
        "annual_fee_waiver_rule": "70% waiver on 50% utilization of total limit within 3 months of issuance or renewal.",
        "minimum_age_years": 21,
        "maximum_age_years": 70
      },
      "sources": [
        "https://askaribank.com/personal/cards/mastercard-credit-cards",
        "https://askaribank.com/gallery/SOC%2001-01-2026%20Final-1212025.pdf"
      ],
      "confidence": "high",
      "notes": [
        "Eligibility comes from the shared Mastercard page rather than a Gold-only page.",
        "The lowest published salaried threshold on that page is PKR 35,000 for GOP/Semi-Govt./Autonomous permanent employees; other salaried categories are higher.",
        "SEB/SEP applicants are shown separately with PKR 150,000 average-balance criterion."
      ]
    },
    {
      "card_name": "Askari Mastercard Platinum Credit Card",
      "card_type": "credit",
      "tier": "platinum",
      "requirements": {
        "minimum_monthly_salary_pkr": 35000,
        "minimum_relationship_balance_pkr": 150000,
        "annual_fee_pkr": 19500,
        "annual_fee_waiver_rule": "70% waiver on 50% utilization of total limit within 3 months of issuance or renewal.",
        "minimum_age_years": 21,
        "maximum_age_years": 70
      },
      "sources": [
        "https://askaribank.com/personal/cards/mastercard-credit-cards",
        "https://askaribank.com/gallery/SOC%2001-01-2026%20Final-1212025.pdf"
      ],
      "confidence": "high",
      "notes": [
        "Eligibility comes from the shared Mastercard page rather than a Platinum-only page.",
        "The lowest published salaried threshold on that page is PKR 35,000 for GOP/Semi-Govt./Autonomous permanent employees; other salaried categories are higher.",
        "SEB/SEP applicants are shown separately with PKR 150,000 average-balance criterion."
      ]
    },
    {
      "card_name": "Askari World Mastercard Credit Card",
      "card_type": "credit",
      "tier": "world",
      "requirements": {
        "minimum_monthly_salary_pkr": 1000000,
        "minimum_relationship_balance_pkr": null,
        "annual_fee_pkr": 23000,
        "annual_fee_waiver_rule": "70% waiver on 50% utilization of total limit within 3 months of issuance or renewal.",
        "minimum_age_years": 21,
        "maximum_age_years": 70
      },
      "sources": [
        "https://askaribank.com/personal/cards/askari-world-mastercard-credit-card",
        "https://askaribank.com/gallery/SOC%2001-01-2026%20Final-1212025.pdf"
      ],
      "confidence": "high",
      "notes": [
        "Product page directly exposes the higher World eligibility thresholds.",
        "The official World page publishes minimum income as PKR 1.00 million for salaried applicants and PKR 2.00 million for SEB/SEP applicants.",
        "No separate public deposit-relationship threshold was found on the World card page in this pass."
      ]
    },
    {
      "card_name": "Askari Visa Debit Card Classic",
      "card_type": "debit",
      "tier": "classic",
      "requirements": {
        "minimum_monthly_salary_pkr": 0,
        "minimum_account_balance_pkr": 0,
        "annual_fee_pkr": 3000,
        "annual_fee_waiver_rule": null,
        "minimum_age_years": null,
        "maximum_age_years": null
      },
      "sources": [
        "https://askaribank.com/personal/cards/askari-visa-debit-card",
        "https://askaribank.com/gallery/SOC%2001-01-2026%20Final-1212025.pdf"
      ],
      "confidence": "high",
      "notes": [
        "Card page says no minimum balance requirement for issuance or retention."
      ]
    },
    {
      "card_name": "Askari Visa Signature Debit Card",
      "card_type": "debit",
      "tier": "signature",
      "requirements": {
        "minimum_monthly_salary_pkr": 0,
        "minimum_relationship_balance_pkr": 5000000,
        "annual_fee_pkr": 18000,
        "annual_fee_waiver_rule": "Relationship-based eligibility page shows the card for customers maintaining PKR 5,000,000 quarterly average relationship; SOC lists PKR 18,000 standard annual fee.",
        "minimum_age_years": null,
        "maximum_age_years": null
      },
      "sources": [
        "https://askaribank.com/personal/cards/askari-visa-debit-card",
        "https://askaribank.com/gallery/SOC%2001-01-2026%20Final-1212025.pdf"
      ],
      "confidence": "high",
      "notes": [
        "Eligibility is relationship-balance based rather than salary based on the official card page.",
        "The page shows PKR 5,000,000 quarterly average relationship for conventional current, Islamic current, Islamic savings, or CASA relationship."
      ]
    },
    {
      "card_name": "Askari PayPak Debit Card Gold",
      "card_type": "debit",
      "tier": "gold",
      "requirements": {
        "minimum_monthly_salary_pkr": 0,
        "minimum_account_balance_pkr": 0,
        "joining_fee_pkr": 2400,
        "annual_fee_pkr": 2400,
        "annual_fee_waiver_rule": null,
        "minimum_age_years": null,
        "maximum_age_years": null
      },
      "sources": [
        "https://askaribank.com/personal/cards/paypak-debit-card",
        "https://askaribank.com/personal/accounts/current-account-pkr/askari-asaan-current-account",
        "https://askaribank.com/personal/accounts/askari-asaan-saving-account",
        "https://askaribank.com/gallery/SOC%2001-01-2026%20Final-1212025.pdf"
      ],
      "confidence": "high",
      "notes": [
        "PayPak debit issuance is account-linked rather than salary-gated on the public card page.",
        "Official Askari Asaan Current and Asaan Saving account pages surface PKR 100 opening amount and no minimum balance requirement.",
        "Those no-minimum-balance account pages advertise PayPak debit card issuance, while the SOC provides the standard joining and annual fee."
      ]
    }
  ],
  "gaps": [
    "Debit-card pages do not clearly publish age criteria.",
    "Debit cards are mostly account-linked, so salary requirements are usually absent.",
    "Some shared credit-card eligibility values need later refinement by applicant category rather than one single threshold."
  ]
}
