{
  "bank_slug": "bankislami",
  "bank_name": "BankIslami",
  "retrieved_note": "Pilot agent extraction from official public pages and SOC PDF. Normalize before shipping to UI.",
  "cards": [
    {
      "card_name": "Classic Debit Mastercard",
      "card_type": "debit",
      "tier": "classic",
      "requirements": {
        "minimum_monthly_salary_pkr": 0,
        "minimum_account_balance_pkr": 0,
        "annual_fee_pkr": 2900,
        "annual_fee_waiver_rule": null,
        "minimum_age_years": null,
        "maximum_age_years": null
      },
      "sources": [
        "https://bankislami.com.pk/digital-channel/debitcards/classic-debit-mastercard/",
        "https://bankislami.com.pk/schedule-of-charges/",
        "https://bankislami.com.pk/wp-content/uploads/2026/01/Schedule-of-Charges-SOC-Jan-June-2026.pdf",
        "https://bankislami.com.pk/mashal-women-/"
      ],
      "confidence": "high",
      "notes": [
        "No minimum balance condition per official product page.",
        "The public Jan-Jun 2026 SOC lists Classic Debit Mastercard issuance, annual subscription, and replacement at PKR 2,900.",
        "Fee logic depends partly on the underlying account relationship."
      ]
    },
    {
      "card_name": "PayPak Debit Card",
      "card_type": "debit",
      "tier": "other",
      "requirements": {
        "minimum_monthly_salary_pkr": 0,
        "minimum_account_balance_pkr": 0,
        "annual_fee_pkr": 1800,
        "annual_fee_waiver_rule": null,
        "minimum_age_years": null,
        "maximum_age_years": null
      },
      "sources": [
        "https://bankislami.com.pk/digital-channel/debitcards/paypak-debit-card/",
        "https://bankislami.com.pk/schedule-of-charges/",
        "https://bankislami.com.pk/wp-content/uploads/2026/01/Schedule-of-Charges-SOC-Jan-June-2026.pdf",
        "https://bankislami.com.pk/mashal-women-/"
      ],
      "confidence": "high",
      "notes": [
        "No minimum balance condition per official product page.",
        "The public Jan-Jun 2026 SOC lists PayPak Debit Card issuance, annual subscription, and replacement at PKR 1,800."
      ]
    },
    {
      "card_name": "Titanium Debit Mastercard",
      "card_type": "debit",
      "tier": "titanium",
      "requirements": {
        "minimum_monthly_salary_pkr": null,
        "minimum_account_balance_pkr": 25000,
        "annual_fee_pkr": 4000,
        "annual_fee_waiver_rule": "Fee waived if PKR 25,000 average monthly balance maintained",
        "minimum_age_years": null,
        "maximum_age_years": null
      },
      "sources": [
        "https://bankislami.com.pk/titanium-debit-mastercard/",
        "https://bankislami.com.pk/wp-content/uploads/2022/07/FAQs-Titanium-Debit-Mastercard.pdf",
        "https://bankislami.com.pk/wp-content/uploads/2026/01/Schedule-of-Charges-SOC-Jan-June-2026.pdf",
        "https://bankislami.com.pk/prioritybanking/",
        "https://onboard.bankislami.com.pk/static/media/Products%20Brief%20Description%20-%20Digital%20Onboarding%20Final.f03233bc.pdf"
      ],
      "confidence": "high",
      "notes": [
        "PKR 25,000 average balance unlocks fee waiver. No salary threshold publicly disclosed.",
        "The public 2026 SOC lists the ordinary Titanium Debit Mastercard at PKR 4,000 for issuance/annual subscription/replacement.",
        "Priority Titanium appears to be a distinct premium variant with fee waivers and a separate Priority relationship criterion, so the ordinary Titanium record keeps salary and balance thresholds as null."
      ]
    }
  ],
  "gaps": [
    "No clear public consumer credit-card catalogue was found in this pass.",
    "Public pages do not clearly publish salary, age, or balance thresholds for ordinary debit cards.",
    "The cleanest fee source is the 2026 SOC PDF."
  ]
}
